{
  "schema_version": "q-demo.candidate-evidence.v1",
  "candidate_ref": "cand:eeeeeeeeeeeeeeee:8",
  "camera_id": "CAM_X",
  "window_us": [
    8400000,
    14400000
  ],
  "target_presence": "MATCH_STRONG",
  "frames": {
    "evaluated": 15,
    "not_sampled": 0,
    "not_inferred": 0,
    "missing": 0
  },
  "coverage_complete": true,
  "partial_basis": null,
  "decision_time_us": 9200000,
  "entry_observation_id": null,
  "entry_timestamp_us": null,
  "best_observations": [
    {
      "observation_id": "obs:f96c0d0ec4417b67:CAM_X:45:0",
      "frame_ref": "frame:RUN_X:CAM_X:45",
      "timestamp_us": 9000000,
      "score": 0.8,
      "color_verdict": "STRONG",
      "bbox_xyxy_px": [
        300.0,
        100.0,
        360.0,
        260.0
      ]
    }
  ],
  "matching_observation_count": 1,
  "first_match_us": 9000000,
  "evidence_sha256": "c4ac1c0013542d4a54773c16684a31d1be7006270304843e6c66d051a4b3513f"
}
