{
  "schema_version": "q-demo.candidate-evidence.v1",
  "candidate_ref": "cand:a4360033046d19aa:1",
  "camera_id": "CAM_D",
  "window_us": [
    8400000,
    14400000
  ],
  "target_presence": "PERSON_NO_COLOR_MATCH",
  "frames": {
    "evaluated": 15,
    "not_sampled": 0,
    "not_inferred": 0,
    "missing": 0
  },
  "coverage_complete": true,
  "partial_basis": null,
  "decision_time_us": 9200000,
  "entry_observation_id": null,
  "entry_timestamp_us": null,
  "best_observations": [
    {
      "observation_id": "obs:f96c0d0ec4417b67:CAM_D:50:0",
      "frame_ref": "frame:RUN_X:CAM_D:50",
      "timestamp_us": 10000000,
      "score": 0.7,
      "color_verdict": "NONE",
      "bbox_xyxy_px": [
        300.0,
        100.0,
        360.0,
        260.0
      ]
    }
  ],
  "matching_observation_count": 0,
  "first_match_us": null,
  "evidence_sha256": "dac76f1839a87db338e339d70dcf5753c6ba8850d62eb6dae71ce271c2d4dd3a"
}
